<?xml version="1.0" encoding="UTF-8"?>
<!DOCTYPE SystemOrderStock SYSTEM "system_order_stock.dtd">
<SystemOrderStock>
	<Given>
		<ItemsToOrder>
			<Item>
				<Id>20A</Id>
				<Quantity>2</Quantity>
			</Item>
			<Item>
				<Id>22C</Id>
				<Quantity>1</Quantity>
			</Item>
		</ItemsToOrder>
	</Given>
	<When>
		<Order sent="true"></Order>
	</When>
	<Then>
		<Reply received="true">Order placed</Reply>
	</Then>
</SystemOrderStock>